HEC Need Based Scholarships,http://hec.gov.pk/english/scholarshipsgrants/NBS
Pak-Sri Lanka Higher Education Cooperation Program,http://hec.gov.pk/english/scholarshipsgrants/pshecp
Award of Allama Iqbal Scholarships for Afghan Nationals,http://hec.gov.pk/english/scholarshipsgrants/amisp
HEC Opportunities for  students of Balochistan & FATA,http://hec.gov.pk/english/scholarshipsgrants/BAL-FATA
OGDCL Need Based Scholarships Program through HEC,http://hec.gov.pk/english/scholarshipsgrants/OGDCL-NBSP
Prime Minister Fee Reimbursement Scheme,http://hec.gov.pk/english/scholarshipsgrants/tfp
USAID-funded Merit and Needs-Based Scholarship Program,http://hec.gov.pk/english/scholarshipsgrants/USAID-NeedsBased
Gwadar-China Scholarship Program,http://hec.gov.pk/english/scholarshipsgrants/GCSP
Indigenous Ph.D. Fellowship Program,http://hec.gov.pk/english/scholarshipsgrants/IPHDFP5000F
CLA Dafoe Scholarship,http://scholarships.studentscholarships.org/cla_dafoe_scholarship_638.php
BCIT ABORIGINAL ENTRANCE AWARDS,http://scholarships.studentscholarships.org/bcit_aboriginal_entrance_awards_670.php
BC Radilogical Society Entrance Award,http://scholarships.studentscholarships.org/bc_radilogical_society_entrance_award_679.php
Citytv Vancouver Entrance Awards,http://scholarships.studentscholarships.org/citytv_vancouver_entrance_awards_686.php
Allan G. Goodbrand Memorial Entrance Awards,http://scholarships.studentscholarships.org/allan_g_goodbrand_memorial_entrance_awards_688.php
Jiro Hamaguchi Memorial Entrance Awards,http://scholarships.studentscholarships.org/jiro_hamaguchi_memorial_entrance_awards_689.php
Oracle Corporation Vancouver Entrance Award,http://scholarships.studentscholarships.org/oracle_corporation_vancouver_entrance_award_691.php
Teck Cominco Limited Entrance Award,http://scholarships.studentscholarships.org/teck_cominco_limited_entrance_award_692.php
TimberWest Forest Corp. Entrance Award,http://scholarships.studentscholarships.org/timberwest_forest_corp_entrance_award_693.php
The BCIT Staff ,http://scholarships.studentscholarships.org/the_bcit_staff_high_tech_high_promise_capital_campaign_entrance_award_696.php
Ramsay MacDonald Memorial Entrance Award,http://scholarships.studentscholarships.org/ramsay_macdonald_memorial_entrance_award_701.php
James Ehnes Scholarship in Strings,http://scholarships.studentscholarships.org/james_ehnes_scholarship_in_strings_724.php
James Harvey Tolton Memorial Scholarship,http://scholarships.studentscholarships.org/james_harvey_tolton_memorial_scholarship_737.php
Pallister Entrance Scholarships,http://scholarships.studentscholarships.org/pallister_entrance_scholarships_739.php
Delameter-Wood 50th Anniversary Scholarship,http://scholarships.studentscholarships.org/delameter_wood_50th_anniversary_scholarship_743.php
Phillippa Saul Memorial Bursaries in Arts and Music,http://scholarships.studentscholarships.org/phillippa_saul_memorial_bursaries_in_arts_and_music_745.php
Anne Selley (nee McKillop) and Annie Truesdall Bursaries,http://scholarships.studentscholarships.org/anne_selley_nee_mckillop_and_annie_truesdall_bursaries_746.php
Brandon Regional Health Center Auxilliary Bursary,http://scholarships.studentscholarships.org/brandon_regional_health_center_auxilliary_bursary_751.php
James of Goodlands Bursaries,http://scholarships.studentscholarships.org/james_of_goodlands_bursaries_752.php
Scotiabank Scholarship for Aboriginal students in financial need,http://scholarships.studentscholarships.org/scotiabank_scholarship_for_aboriginal_students_in_financial_need_753.php
Dr. Doreen (Rowse) Pachal Bursary,http://scholarships.studentscholarships.org/dr_doreen_rowse_pachal_bursary_758.php
Manitoba Blue Cross Entrance Bursary,http://scholarships.studentscholarships.org/manitoba_blue_cross_entrance_bursary_761.php
Manitoba Blue Cross Traveller's Bursary,http://scholarships.studentscholarships.org/manitoba_blue_cross_traveller_s_bursary_762.php
Dr. Kevin and Mrs. Els Kavanagh Entrance Bursary,http://scholarships.studentscholarships.org/dr_kevin_and_mrs_els_kavanagh_entrance_bursary_763.php
Dr. Jack Norman Edmison Memorial Bursary,http://scholarships.studentscholarships.org/dr_jack_norman_edmison_memorial_bursary_768.php
Coast Salish Employment Training Society Award,http://scholarships.studentscholarships.org/coast_salish_employment_training_society_award_779.php
The Bolen Books English Essay Award,http://scholarships.studentscholarships.org/the_bolen_books_english_essay_award_786.php
Robert Martin History Scholarship,http://scholarships.studentscholarships.org/robert_martin_history_scholarship_799.php
Geography Faculty Award,http://scholarships.studentscholarships.org/geography_faculty_award_801.php
Applied Chemistry & Biotechnology Program Achievement ,http://scholarships.studentscholarships.org/applied_chemistry_biotechnology_program_achievement_award_for_biotechnology_806.php
Dave and Bev Knapton Associate Degree of Science Scholarship,http://scholarships.studentscholarships.org/dave_and_bev_knapton_associate_degree_of_science_scholarship_811.php
Co-op Education Continuing Student Award,http://scholarships.studentscholarships.org/air_and_waste_management_association_co_op_education_continuing_student_award_814.php
CellFor Community Education Excellence Graduate Award,http://scholarships.studentscholarships.org/cellfor_community_education_excellence_graduate_award_816.php
CellFor Community Education Excellence Graduate Award,http://scholarships.studentscholarships.org/cellfor_community_education_excellence_graduate_award_817.php
URSUS Environmental Excellence in Biodiversity Award,http://scholarships.studentscholarships.org/ursus_environmental_excellence_in_biodiversity_award_819.php
Jack O. Hurlbut Scholarship,http://scholarships.studentscholarships.org/jack_o_hurlbut_scholarship_827.php
Florence Montgomery Scholarship,http://scholarships.studentscholarships.org/florence_montgomery_scholarship_842.php
Nat Bailey Scholarships,http://scholarships.studentscholarships.org/nat_bailey_scholarships_845.php
Garland Commercial Ranges Scholarships,http://scholarships.studentscholarships.org/garland_commercial_ranges_scholarships_852.php
ARAMARK Canada Scholarship,http://scholarships.studentscholarships.org/aramark_canada_scholarship_854.php
Andrew Peller Limited Scholarship,http://scholarships.studentscholarships.org/andrew_peller_limited_scholarship_855.php
Coca-Cola Bottling Co. Scholarship,http://scholarships.studentscholarships.org/coca_cola_bottling_co_scholarship_859.php
Boston Pizza Scholarship,http://scholarships.studentscholarships.org/boston_pizza_scholarship_865.php
Cara Operations Scholarship,http://scholarships.studentscholarships.org/cara_operations_scholarship_867.php
Granite Club Scholarship,http://scholarships.studentscholarships.org/granite_club_scholarship_869.php
The Garland Group Scholarship,http://scholarships.studentscholarships.org/the_garland_group_scholarship_871.php
Trimen Food Equipment Group Scholarship,http://scholarships.studentscholarships.org/trimen_food_equipment_group_scholarship_872.php
Jack Hemmings Scholarship,http://scholarships.studentscholarships.org/jack_hemmings_scholarship_877.php
Metro Toronto Convention Centre Scholarship,http://scholarships.studentscholarships.org/metro_toronto_convention_centre_scholarship_878.php
Church Service Scholarships,http://scholarships.studentscholarships.org/church_service_scholarships_881.php
OuttatownLeadership Scholarship,http://scholarships.studentscholarships.org/outtatownleadership_scholarship_885.php
Richard Lewar Scholarships,http://scholarships.studentscholarships.org/richard_lewar_scholarships_895.php
Scholarship for Public Affairs and Policy Management,http://scholarships.studentscholarships.org/scholarship_for_public_affairs_and_policy_management_students_entering_in_fall_2007_898.php
Scholarships for Transfer Students,http://scholarships.studentscholarships.org/scholarships_for_transfer_students_899.php
The Association of Canadian Financial Officers Prize,http://scholarships.studentscholarships.org/the_association_of_canadian_financial_officers_prize_903.php
"Bank of Nova Scotia, Carleton University Branch",http://scholarships.studentscholarships.org/bank_of_nova_scotia_carleton_university_branch_award_in_commercial_law_904.php
Dr. M. Ralph Berke Award in Chemistry,http://scholarships.studentscholarships.org/dr_m_ralph_berke_award_in_chemistry_905.php
The Canadian Corporate News Scholarship in Journalism,http://scholarships.studentscholarships.org/the_canadian_corporate_news_scholarship_in_journalism_911.php
W.H. Collins Memorial Scholarship,http://scholarships.studentscholarships.org/w_h_collins_memorial_scholarship_919.php
W.R. Davis Engineering Scholarship,http://scholarships.studentscholarships.org/w_r_davis_engineering_scholarship_921.php
"Lord Dundonald Chapter, I.O.D.E. Scholarship",http://scholarships.studentscholarships.org/lord_dundonald_chapter_i_o_d_e_scholarship_924.php
Department of French Scholarship,http://scholarships.studentscholarships.org/department_of_french_scholarship_929.php
Golder Associates Award,http://scholarships.studentscholarships.org/golder_associates_award_931.php
Thomas Henry Hartman Award in Humorous Writing,http://scholarships.studentscholarships.org/thomas_henry_hartman_award_in_humorous_writing_933.php
David Carton MacDonald Memorial Award,http://scholarships.studentscholarships.org/david_carton_macdonald_memorial_award_940.php
Helen Nininger Scholarship in Music,http://scholarships.studentscholarships.org/helen_nininger_scholarship_in_music_941.php
Ontario Power Generation Award,http://scholarships.studentscholarships.org/ontario_power_generation_award_942.php
Entrance Scholarships,http://scholarships.studentscholarships.org/ontario_professional_engineers_foundation_for_education_fund_entrance_scholarships_944.php
Ottawa Citizen Scholarship,http://scholarships.studentscholarships.org/ottawa_citizen_scholarship_946.php
Ottawa Citizen Scholarship in Journalism,http://scholarships.studentscholarships.org/ottawa_citizen_scholarship_in_journalism_947.php
 Recognition of Academic Excellence Award,http://scholarships.studentscholarships.org/ottawa_hydro_carl_f_kropp_recognition_of_academic_excellence_award_948.php
The Page and Steele School of Architecture Scholarship,http://scholarships.studentscholarships.org/the_page_and_steele_school_of_architecture_scholarship_949.php
Prince Memorial Achievement Award,http://scholarships.studentscholarships.org/prince_memorial_achievement_award_951.php
Purvins Memorial Award,http://scholarships.studentscholarships.org/purvins_memorial_award_952.php
Barbie Ross Memorial Award,http://scholarships.studentscholarships.org/barbie_ross_memorial_award_954.php
Kenneth Tang Memorial Scholarship,http://scholarships.studentscholarships.org/kenneth_tang_memorial_scholarship_959.php
Norman and Carole Zagerman Varsity Basketball Scholarship,http://scholarships.studentscholarships.org/norman_and_carole_zagerman_varsity_basketball_scholarship_964.php
Northern Research Internships,http://scholarships.studentscholarships.org/northern_research_internships_969.php
Industrial Undergraduate Student Research Awards (USRA),http://scholarships.studentscholarships.org/industrial_undergraduate_student_research_awards_usra_971.php
NSERC Postgraduate Scholarships (PGS) D,http://scholarships.studentscholarships.org/nserc_postgraduate_scholarships_pgs_d_975.php
Industrial Innovation Scholarships (IIS) Master's Level,http://scholarships.studentscholarships.org/industrial_innovation_scholarships_iis_master_s_level_977.php
Industrial Innovation Scholarships (IIS) Doctoral Level,http://scholarships.studentscholarships.org/industrial_innovation_scholarships_iis_doctoral_level_978.php
Postdoctoral Fellowships (PDF),http://scholarships.studentscholarships.org/postdoctoral_fellowships_pdf_980.php
University Faculty Awards (UFA),http://scholarships.studentscholarships.org/university_faculty_awards_ufa_981.php
In-course Scholarship,http://scholarships.studentscholarships.org/in_course_scholarship_1002.php
Peter Balback Memorial Bursary,http://scholarships.studentscholarships.org/peter_balback_memorial_bursary_1004.php
Reverend and Mrs. Carl R. Baron Bursary,http://scholarships.studentscholarships.org/reverend_and_mrs_carl_r_baron_bursary_1005.php
John Chomiak Political Economy Bursary,http://scholarships.studentscholarships.org/john_chomiak_political_economy_bursary_1007.php
Concordia Guild Scholarship,http://scholarships.studentscholarships.org/concordia_guild_scholarship_1008.php
Concordia Leadership Award,http://scholarships.studentscholarships.org/concordia_leadership_award_1009.php
Edmonton Realtors' Charitable Foundation Bursary,http://scholarships.studentscholarships.org/edmonton_realtors_charitable_foundation_bursary_for_disabled_students_1015.php
Edmonton Rotary Club Bursary,http://scholarships.studentscholarships.org/edmonton_rotary_club_bursary_1016.php
Carl J. Hennig Memorial Scholarship,http://scholarships.studentscholarships.org/carl_j_hennig_memorial_scholarship_1019.php
K. T. W. Scholarship,http://scholarships.studentscholarships.org/k_t_w_scholarship_1021.php
Mature Students' Association Scholarship,http://scholarships.studentscholarships.org/mature_students_association_scholarship_1023.php
Samuel and Amalia Rosnau Memorial Scholarship,http://scholarships.studentscholarships.org/samuel_and_amalia_rosnau_memorial_scholarship_1031.php
Royal Bank Scholarship,http://scholarships.studentscholarships.org/royal_bank_scholarship_1035.php
Constable Peter Schiemann Memorial Scholarship,http://scholarships.studentscholarships.org/constable_peter_schiemann_memorial_scholarship_1036.php
Walter Wangerin Scholarship,http://scholarships.studentscholarships.org/walter_wangerin_scholarship_1039.php
TEAL Mary Ashworth Scholarship,http://scholarships.studentscholarships.org/teal_mary_ashworth_scholarship_1045.php
Simon Fraser Scholarship,http://scholarships.studentscholarships.org/simon_fraser_scholarship_1048.php
Gordon M. Shrum Scholarships,http://scholarships.studentscholarships.org/gordon_m_shrum_scholarships_1050.php
H.Y. Louie Entrance Awards,http://scholarships.studentscholarships.org/h_y_louie_entrance_awards_1055.php
Community Entrance Awards,http://scholarships.studentscholarships.org/community_entrance_awards_1057.php
 Foundation Entrance Scholarship in Business Administration,http://scholarships.studentscholarships.org/lloyd_carr_harris_foundation_entrance_scholarship_in_business_administration_1058.php
International Summit Scholarships,http://scholarships.studentscholarships.org/international_summit_scholarships_1061.php
Tadeusz Specht Memorial Scholarships,http://scholarships.studentscholarships.org/tadeusz_specht_memorial_scholarships_1063.php
Honourable William H. Hamilton Scholarships,http://scholarships.studentscholarships.org/honourable_william_h_hamilton_scholarships_1065.php
Ken Caple Scholarships,http://scholarships.studentscholarships.org/ken_caple_scholarships_1066.php
The BBPA Harry Jerome Legacy Scholarships,http://scholarships.studentscholarships.org/the_bbpa_harry_jerome_legacy_scholarships_1090.php
The Robert K. Brown Scholarship,http://scholarships.studentscholarships.org/the_robert_k_brown_scholarship_1093.php
The CIBC Scholarship,http://scholarships.studentscholarships.org/the_cibc_scholarship_1094.php
The TD Bank Scholarships,http://scholarships.studentscholarships.org/the_td_bank_scholarships_1104.php
LAKEHEAD UNIVERSITY NORTHWESTERN  LEADERS' SCHOLARSHIP,http://scholarships.studentscholarships.org/lakehead_university_northwestern_ontario_leaders_scholarship_1117.php
The National Deans' Entrance Scholarships for Excellence,http://scholarships.studentscholarships.org/the_national_deans_entrance_scholarships_for_excellence_1125.php
The Leadership Awards Program,http://scholarships.studentscholarships.org/the_leadership_awards_program_1126.php
Laurentian University Entrance Bursaries,http://scholarships.studentscholarships.org/laurentian_university_entrance_bursaries_1127.php
Jacqueline Labelle Award,http://scholarships.studentscholarships.org/jacqueline_labelle_award_1128.php
The Gerald (KStJ) and Marguerite Lougheed Scholarship,http://scholarships.studentscholarships.org/the_gerald_kstj_and_marguerite_lougheed_scholarship_1129.php
The Dowling Horseshoe Club Bursary,http://scholarships.studentscholarships.org/the_dowling_horseshoe_club_bursary_1130.php
The Association  francophones Scholarship,http://scholarships.studentscholarships.org/the_association_des_etudiantes_et_etudiants_francophones_scholarship_1133.php
The Laurentian University Faculty Association Scholarship,http://scholarships.studentscholarships.org/the_laurentian_university_faculty_association_scholarship_1136.php
The Thomas Balfe Memorial Award,http://scholarships.studentscholarships.org/the_thomas_balfe_memorial_award_1139.php
The Senator Rheal Belisle Scholarships,http://scholarships.studentscholarships.org/the_senator_rheal_belisle_scholarships_1145.php
The Marsh A. Cooper Award in Geology,http://scholarships.studentscholarships.org/the_marsh_a_cooper_award_in_geology_1146.php
The Dr. Baxter Ricard Scholarship,http://scholarships.studentscholarships.org/the_dr_baxter_ricard_scholarship_1147.php
de Sudbury Award in the School of Education,http://scholarships.studentscholarships.org/the_chapitre_des_caisses_populaires_de_sudbury_award_in_the_school_of_education_1148.php
Professional Staff Association Scholarship,http://scholarships.studentscholarships.org/the_laurentian_university_administrative_and_professional_staff_association_scholarship_1149.php
The Elizabeth Burton Award,http://scholarships.studentscholarships.org/the_elizabeth_burton_award_1151.php
The Pearl Hagen Memorial Awards,http://scholarships.studentscholarships.org/the_pearl_hagen_memorial_awards_1152.php
The Helen Byrnes Memorial Award,http://scholarships.studentscholarships.org/the_helen_byrnes_memorial_award_1153.php
The Margaret Fyfe-Orange Memorial Awards,http://scholarships.studentscholarships.org/the_margaret_fyfe_orange_memorial_awards_1155.php
The Mrs. Dominga de la Riva Memorial Scholarships,http://scholarships.studentscholarships.org/the_mrs_dominga_de_la_riva_memorial_scholarships_1156.php
The Joe Fabbro Memorial Award,http://scholarships.studentscholarships.org/the_joe_fabbro_memorial_award_1159.php
The Inco Limited Mining Awards,http://scholarships.studentscholarships.org/the_inco_limited_mining_awards_1170.php
The Sylvain L. Dugas Scholarship,http://scholarships.studentscholarships.org/the_sylvain_l_dugas_scholarship_1173.php
Laurentian University Karate Club Scholarship,http://scholarships.studentscholarships.org/laurentian_university_karate_club_scholarship_1175.php
History Department Prize,http://scholarships.studentscholarships.org/history_department_prize_1177.php
The Edwin J. Wiley Scholarship,http://scholarships.studentscholarships.org/the_edwin_j_wiley_scholarship_1180.php
The Brian J. Croteau Memorial Scholarship,http://scholarships.studentscholarships.org/the_brian_j_croteau_memorial_scholarship_1181.php
The Dr. M. Yousaf Memorial Scholarship in Mathematics,http://scholarships.studentscholarships.org/the_dr_m_yousaf_memorial_scholarship_in_mathematics_1182.php
The Dr. George and Mary Walker Memorial Scholarship,http://scholarships.studentscholarships.org/the_dr_george_and_mary_walker_memorial_scholarship_1186.php
Sudbury and District Chartered Accountants Association Scholarship,http://scholarships.studentscholarships.org/sudbury_and_district_chartered_accountants_association_scholarship_1189.php
The Purchasing-Management Association  Scholarship,http://scholarships.studentscholarships.org/the_purchasing_management_association_of_canada_sudbury_district_scholarship_1190.php
The Harold and Ethel Bennett Memorial Scholarship,http://scholarships.studentscholarships.org/the_harold_and_ethel_bennett_memorial_scholarship_1191.php
The R.D. Scholarship for Women in Mining Engineering,http://scholarships.studentscholarships.org/the_r_d_parker_memorial_scholarship_for_women_in_mining_engineering_1193.php
Engineers Foundation for Education Upper-year Scholarships,http://scholarships.studentscholarships.org/the_ontario_professional_engineers_foundation_for_education_upper_year_scholarships_1194.php
L.U. - Louise de Kiriline Lawrence Scholarships,http://scholarships.studentscholarships.org/l_u_louise_de_kiriline_lawrence_scholarships_1195.php
The F. Jean MacLeod Conservation Endowment Scholarships,http://scholarships.studentscholarships.org/the_f_jean_macleod_conservation_endowment_scholarships_1196.php
L.U. In-Course Scholarships,http://scholarships.studentscholarships.org/l_u_in_course_scholarships_1199.php
The Thayer Lindsley Scholarship,http://scholarships.studentscholarships.org/the_thayer_lindsley_scholarship_1202.php
The Carl and Lyle Sanders Scholarships,http://scholarships.studentscholarships.org/the_carl_and_lyle_sanders_scholarships_1203.php
The Carl J. Sanders Scholarships,http://scholarships.studentscholarships.org/the_carl_j_sanders_scholarships_1206.php
The Frank S. Ressel Memorial Scholarships,http://scholarships.studentscholarships.org/the_frank_s_ressel_memorial_scholarships_1207.php
The L.U. 35th Anniversary President's Scholarships,http://scholarships.studentscholarships.org/the_l_u_35th_anniversary_president_s_scholarships_1208.php
The Peter Barott Scholarship,http://scholarships.studentscholarships.org/the_peter_barott_scholarship_1209.php
The R.J. Askin Memorial Scholarship,http://scholarships.studentscholarships.org/the_r_j_askin_memorial_scholarship_1210.php
BC Lions Society Advanced Education Fund Entrance Award,http://scholarships.studentscholarships.org/bc_lions_society_advanced_education_fund_entrance_award_1216.php
CIBC Entrance Awards,http://scholarships.studentscholarships.org/cibc_entrance_awards_1219.php
Frank Ney Memorial Entrance Award,http://scholarships.studentscholarships.org/frank_ney_memorial_entrance_award_1222.php
Herold Engineering Entrance Award,http://scholarships.studentscholarships.org/herold_engineering_entrance_award_1224.php
Malaspina University-College Degree Entrance Scholarships,http://scholarships.studentscholarships.org/malaspina_university_college_degree_entrance_scholarships_1232.php
Associated Canadian Travelers Award,http://scholarships.studentscholarships.org/associated_canadian_travelers_award_1235.php
BMO Bank of Montreal Awards for Aboriginal Students,http://scholarships.studentscholarships.org/bmo_bank_of_montreal_awards_for_aboriginal_students_1237.php
Canadian Federation of University Women - Cowichan Valley Award,http://scholarships.studentscholarships.org/canadian_federation_of_university_women_cowichan_valley_award_1238.php
Canadian Federation of University Women - Nanaimo Scholarship,http://scholarships.studentscholarships.org/canadian_federation_of_university_women_nanaimo_scholarship_1239.php
Canada Millennium Scholarship  National In-Course Awards,http://scholarships.studentscholarships.org/canada_millennium_scholarship_foundation_national_in_course_awards_1241.php
CanWest Global Communications Scholarship,http://scholarships.studentscholarships.org/canwest_global_communications_scholarship_1242.php
Cloverdale Paint Award,http://scholarships.studentscholarships.org/cloverdale_paint_award_1243.php
Coastal Community Credit Union Award,http://scholarships.studentscholarships.org/coastal_community_credit_union_award_1244.php
Cowichan Dogwoods Chapter of the IODE Award,http://scholarships.studentscholarships.org/cowichan_dogwoods_chapter_of_the_iode_award_1246.php
Credit Union Foundation of BC Awards,http://scholarships.studentscholarships.org/credit_union_foundation_of_bc_awards_1248.php
CUPE Local 1858 Scholarship,http://scholarships.studentscholarships.org/cupe_local_1858_scholarship_1249.php
Cyril S. White & Family Award,http://scholarships.studentscholarships.org/cyril_s_white_family_award_1250.php
Elizabeth Newham Award,http://scholarships.studentscholarships.org/elizabeth_newham_award_1256.php
Global Studies Award,http://scholarships.studentscholarships.org/global_studies_award_1260.php
Irene Shoop Memorial Awards,http://scholarships.studentscholarships.org/irene_shoop_memorial_awards_1262.php
Kathryn Barnwell Award,http://scholarships.studentscholarships.org/kathryn_barnwell_award_1266.php
Leanne Johnson Memorial Award,http://scholarships.studentscholarships.org/leanne_johnson_memorial_award_1267.php
Malaspina University-College Graduation Awards,http://scholarships.studentscholarships.org/malaspina_university_college_graduation_awards_1272.php
Nanaimo Riptide Swim Team Alumni Award,http://scholarships.studentscholarships.org/nanaimo_riptide_swim_team_alumni_award_1279.php
Oceanside Rotary Award,http://scholarships.studentscholarships.org/oceanside_rotary_award_1281.php
Ramsay Lampman Rhodes Award,http://scholarships.studentscholarships.org/ramsay_lampman_rhodes_award_1283.php
Robert Ross Memorial Scholarship,http://scholarships.studentscholarships.org/robert_ross_memorial_scholarship_1287.php
Robyn Muir Memorial Award,http://scholarships.studentscholarships.org/robyn_muir_memorial_award_1288.php
Rotary Club of Nanaimo - Helmut Graf International Awards,http://scholarships.studentscholarships.org/rotary_club_of_nanaimo_helmut_graf_international_awards_1289.php
Rotary Club of Nanaimo North Award,http://scholarships.studentscholarships.org/rotary_club_of_nanaimo_north_award_1290.php
Royal Bank Awards,http://scholarships.studentscholarships.org/royal_bank_awards_1291.php
BC Hydro Endowment Award,http://scholarships.studentscholarships.org/bc_hydro_endowment_award_1295.php
Judith Arnold Awards,http://scholarships.studentscholarships.org/judith_arnold_awards_1297.php
Kiwanis Sunrisers Special Needs Awards,http://scholarships.studentscholarships.org/kiwanis_sunrisers_special_needs_awards_1298.php
